{
  "schemaVersion": "2.0.0",
  "recordType": "source-registry",
  "generatedAt": "2026-09-07T00:00:00Z",
  "agentId": "gtm-lead-registry-expansion-2026-09-07",
  "sources": [
    {
      "identity": {
        "sourceId": "accessdata-fda",
        "aliases": [
          "accessdata-fda-daf-021332",
          "accessdata-fda-saxenda-label-2026",
          "accessdata-fda-victoza-label-2025",
          "fda-accessdata-scenesse-label-2019",
          "fda-accessdata-scenesse-label-2024-s007",
          "fda-azmiro-label-2022",
          "fda-bydureon-label-2024",
          "fda-daf-saxenda-nda206321",
          "fda-daf-victoza-nda022341",
          "fda-drugsatfda-nda022247",
          "fda-fareston-sndsa-2024ltr",
          "fda-forzinity-approval-package-215244",
          "fda-import-alert-66-71",
          "fda-label-2020-210557s002lbl",
          "fda-osphena-label-pdf"
        ],
        "name": "FDA Drugs@FDA / accessdata",
        "publisher": "U.S. Food and Drug Administration",
        "primaryUrl": "https://accessdata.fda.gov/",
        "sourceType": "regulator",
        "jurisdictions": [
          "US"
        ],
        "categoriesCovered": [
          "regulatory",
          "labels"
        ]
      },
      "rights": {
        "reviewStatus": "pending-human-legal",
        "legalBasisOrLicense": null,
        "termsUrl": null,
        "verifiedAtUtc": null,
        "allowedUses": [],
        "prohibitedUses": [
          "all-acquisition-and-use-until-human-legal-approval"
        ],
        "redistributionConstraints": [
          "not-reviewed"
        ],
        "reviewedByRole": null
      },
      "operations": {
        "status": "disabled",
        "ownerRole": null,
        "securityOwnerRole": null,
        "lastReviewedAtUtc": "2026-09-07T00:00:00Z"
      },
      "acquisition": {
        "enabled": false,
        "method": "manual-review",
        "hasApi": false,
        "hasBulkExport": false,
        "requiresAccount": false,
        "robotsPolicyStatus": "not-applicable",
        "apiTermsStatus": "not-applicable",
        "rateLimitPolicy": "Manual, low-volume retrieval only; back off on any 4xx or 5xx response.",
        "accessNotes": "DEACTIVATED 2026-09-07. This lane was enabled without the legalRights approval that stageGates.sourceActivationRequiredApprovals requires. That approval belongs to the legal-rights-approver named in research/source-authorization/recommended-seven-source-decisions.v1.json and was never obtained. Registration and rights ratification are recorded, but the lane stays inactive until a source-authorization decision batch covering it is issued and bound to this registry."
      },
      "evidencePolicy": {
        "authorityTier": "A1",
        "reliabilityScore": 5,
        "authorizedFieldUse": [
          "identity",
          "regulatory",
          "approved-indications",
          "product-specific-dosing",
          "contraindications-warnings",
          "monitoring",
          "interactions",
          "efficacy-claims"
        ],
        "humanReviewRequirement": "before-canonical-promotion",
        "limitations": [
          "Approved labeling and approval packages support efficacy only for the approved indication as studied in the pivotal trials the label reports; they do not support off-label or general-population efficacy.",
          "Sponsor-submitted content inside an approval package is not an FDA-authored assessment."
        ]
      },
      "provenanceRequirements": {
        "requiredFields": [
          "sourceRegistryId",
          "sourceItemId",
          "sourceUrl",
          "retrievedAtUtc",
          "rightsReviewStatusAtRetrieval",
          "humanReviewStatus"
        ],
        "citationIdentifierTypes": [
          "source URL"
        ]
      },
      "refreshPolicy": {
        "mode": "manual",
        "cadence": "Manual refresh when a cited record is actively reviewed.",
        "stalenessAction": "require-review",
        "lastSuccessfulRefreshAtUtc": null
      },
      "remediation": {
        "correctionProcedure": "Quarantine the affected fields and re-resolve them against the cited record.",
        "retractionProcedure": "Block derived fields when the cited record is withdrawn or materially changed.",
        "removalProcedure": "Remove stored content and derived display material while retaining identifiers and a non-content audit record.",
        "contactRole": "product-owner"
      },
      "dataBoundary": {
        "permittedContent": [
          "Source-grounded factual and contextual information with citations and stated uncertainty."
        ],
        "restrictedContent": [
          "Copyrighted full text beyond the reviewed boundary, private or personal data, uncited claims, and content outside the source context."
        ],
        "privateDataAllowed": false,
        "copyrightedFullTextStorageAllowed": false,
        "trainingUseAllowed": false
      }
    },
    {
      "identity": {
        "sourceId": "cdc",
        "aliases": [
          "cdc-mmwr-pediatric-melatonin-2022"
        ],
        "name": "Centers for Disease Control and Prevention",
        "publisher": "CDC",
        "primaryUrl": "https://www.cdc.gov/",
        "sourceType": "guideline",
        "jurisdictions": [
          "US"
        ],
        "categoriesCovered": [
          "public-health"
        ]
      },
      "rights": {
        "reviewStatus": "pending-human-legal",
        "legalBasisOrLicense": null,
        "termsUrl": null,
        "verifiedAtUtc": null,
        "allowedUses": [],
        "prohibitedUses": [
          "all-acquisition-and-use-until-human-legal-approval"
        ],
        "redistributionConstraints": [
          "not-reviewed"
        ],
        "reviewedByRole": null
      },
      "operations": {
        "status": "disabled",
        "ownerRole": null,
        "securityOwnerRole": null,
        "lastReviewedAtUtc": "2026-09-07T00:00:00Z"
      },
      "acquisition": {
        "enabled": false,
        "method": "manual-review",
        "hasApi": false,
        "hasBulkExport": false,
        "requiresAccount": false,
        "robotsPolicyStatus": "not-applicable",
        "apiTermsStatus": "not-applicable",
        "rateLimitPolicy": "Manual, low-volume retrieval only; back off on any 4xx or 5xx response.",
        "accessNotes": "DEACTIVATED 2026-09-07. This lane was enabled without the legalRights approval that stageGates.sourceActivationRequiredApprovals requires. That approval belongs to the legal-rights-approver named in research/source-authorization/recommended-seven-source-decisions.v1.json and was never obtained. Registration and rights ratification are recorded, but the lane stays inactive until a source-authorization decision batch covering it is issued and bound to this registry."
      },
      "evidencePolicy": {
        "authorityTier": "A2",
        "reliabilityScore": 5,
        "authorizedFieldUse": [
          "efficacy-claims",
          "monitoring",
          "misinformation-monitoring"
        ],
        "humanReviewRequirement": "before-canonical-promotion",
        "limitations": [
          "Population-level public-health guidance; not a product label and not individualized advice."
        ]
      },
      "provenanceRequirements": {
        "requiredFields": [
          "sourceRegistryId",
          "sourceItemId",
          "sourceUrl",
          "retrievedAtUtc",
          "rightsReviewStatusAtRetrieval",
          "humanReviewStatus"
        ],
        "citationIdentifierTypes": [
          "source URL"
        ]
      },
      "refreshPolicy": {
        "mode": "manual",
        "cadence": "Manual refresh when a cited record is actively reviewed.",
        "stalenessAction": "require-review",
        "lastSuccessfulRefreshAtUtc": null
      },
      "remediation": {
        "correctionProcedure": "Quarantine the affected fields and re-resolve them against the cited record.",
        "retractionProcedure": "Block derived fields when the cited record is withdrawn or materially changed.",
        "removalProcedure": "Remove stored content and derived display material while retaining identifiers and a non-content audit record.",
        "contactRole": "product-owner"
      },
      "dataBoundary": {
        "permittedContent": [
          "Source-grounded factual and contextual information with citations and stated uncertainty."
        ],
        "restrictedContent": [
          "Copyrighted full text beyond the reviewed boundary, private or personal data, uncited claims, and content outside the source context."
        ],
        "privateDataAllowed": false,
        "copyrightedFullTextStorageAllowed": false,
        "trainingUseAllowed": false
      }
    },
    {
      "identity": {
        "sourceId": "clinicaltrials",
        "aliases": [
          "clinicaltrials-gov-nct03323749",
          "clinicaltrials-nct01144338-results",
          "clinicaltrials-nct03088527",
          "clinicaltrials-nct03359473",
          "clinicaltrials-nct07505745",
          "clinicaltrials-retatrutide-nct04881760",
          "ctgov-nct04561245",
          "ctgov-nct05006885-classic",
          "ctgov-nct06828055-results-status",
          "ctgov-nct07104500-arms-2026",
          "nct06828055",
          "nct06858839"
        ],
        "name": "ClinicalTrials.gov",
        "publisher": "National Library of Medicine",
        "primaryUrl": "https://clinicaltrials.gov/",
        "sourceType": "clinical-trial-registry",
        "jurisdictions": [
          "US",
          "global"
        ],
        "categoriesCovered": [
          "clinical-trials",
          "emerging-research",
          "drug-development"
        ]
      },
      "rights": {
        "reviewStatus": "approved",
        "legalBasisOrLicense": "Approved under the reviewed ClinicalTrials.gov terms for public registry fields with submitter attribution and government-disclaimer context preserved.",